{
  "$schema": "http://json-schema.org/draft-07/schema#",
  "$id": "https://raw.githubusercontent.com/giocaizzi/shortty/main/src/cheatsheets/schema.json",
  "type": "object",
  "required": ["id", "label", "icon", "platforms", "shortcuts"],
  "properties": {
    "$schema": { "type": "string", "description": "Path or URL of this schema, for editor validation: '../schema.json'" },
    "id": { "type": "string", "description": "Source ID, e.g. 'vscode'" },
    "label": { "type": "string", "description": "Display name, e.g. 'VS Code'" },
    "icon": { "type": "string", "description": "Emoji icon" },
    "app": {
      "type": "object",
      "required": ["bundleId", "name"],
      "description": "macOS app bundle whose icon is shown for this source (docs/spec.md §15)",
      "properties": {
        "bundleId": { "type": "string", "description": "CFBundleIdentifier, e.g. 'com.google.Chrome'" },
        "name": { "type": "string", "description": "Bundle name without .app, e.g. 'Google Chrome'" }
      }
    },
    "platforms": {
      "type": "array",
      "items": { "type": "string", "enum": ["darwin", "win32", "linux"] },
      "minItems": 1
    },
    "parser": {
      "type": ["string", "null"],
      "description": "Parser class ID, or null for cheatsheet-only"
    },
    "mergeMode": {
      "type": "string",
      "enum": ["additive", "replace"],
      "description": "How the app combines a user binding with the default of the same command: 'additive' keeps the default unless the config removes it, 'replace' swaps the default's key. Defaults to 'additive'. See docs/spec.md §6.2"
    },
    "lastVerified": {
      "type": "object",
      "properties": {
        "version": { "type": "string" },
        "date": { "type": "string", "format": "date" }
      }
    },
    "defaultPaths": {
      "type": "object",
      "properties": {
        "darwin": { "type": "array", "items": { "type": "string" } },
        "win32": { "type": "array", "items": { "type": "string" } },
        "linux": { "type": "array", "items": { "type": "string" } }
      }
    },
    "shortcuts": {
      "type": "array",
      "items": {
        "type": "object",
        "required": ["command", "rawCommand", "key"],
        "properties": {
          "command": { "type": "string" },
          "rawCommand": { "type": "string" },
          "key": {
            "type": "object",
            "properties": {
              "darwin": { "type": "string" },
              "win32": { "type": "string" },
              "linux": { "type": "string" }
            }
          },
          "category": { "type": "string" },
          "context": { "type": "string" },
          "minVersion": { "type": "string" }
        }
      }
    }
  }
}
