{
  "$schema": "../schema.json",
  "id": "macos-system",
  "label": "macOS System",
  "icon": "🍎",
  "app": { "bundleId": "com.apple.systempreferences", "name": "System Settings" },
  "platforms": ["darwin"],
  "parser": "macos-system",
  "mergeMode": "replace",
  "defaultPaths": {
    "darwin": ["~/Library/Preferences/com.apple.symbolichotkeys.plist", "~/Library/Preferences/.GlobalPreferences.plist"]
  },
  "shortcuts": []
}
